TestCase,pan,client_ref_num
Verify by entering valid linked pan number,BJPPC6837G,Vampire
Verify by entering valid not linked pan number,ANFPR9966C,Vampire
Verify by entering in-valid pan number,BJPPC68377,Vampire
Verify by entering pan number as numeric char,1234567890,Vampire
Verify by entering pan number as alpha char,QWERTYUIOP,Vampire
Verify by entering pan number special char,!@#$%&*(,Vampire
mixed of alpha numeric special char,BJPPC68#&$,Vampire
Verify by entering pan number less than 10 char,BJPPC683,Vampire
Verify by entering pan number more than 10 char,BJPPC6837GGG,Vampire
Verify by leaving pan number empty,,Vampire
Verify by leaving pan number empty space, ,Vampire
Verify by valid client ref number,BJPPC6837G,Vampire
Verify by in-valid client ref number,BJPPC6837G,!@#$%
Verify by leaving client ref number empty,BJPPC6837G,
Verify by leaving client ref number empty space,BJPPC6837G, 
Verify by entering client ref number as 45 char,BJPPC6837G,chandraprakashDchandraprakashDchandraprakashD
Verify by entering client ref number more than 45 char,BJPPC6837G,chandraprakashDchandraprakashDchandraprakashDCC
Verify by changing the 5th char of the pan number,BJPPX6837G,Vampire
Verify by entering pan number in lower case char,bjppc6837g,Vampire
Verify by entering e pan number,BQXPL8246B,Vampire
Entering Firm/Limited Liability Partnership pan number,AAIFL9385M,Vampire
Entering Hindu Undivided Family (HUF) pan number,AAQHS2176D,Vampire
Entering Association of Persons (AOP) pan number,AAAAV2459D,Vampire
Entering Body of Individuals (BOI) pan number,AAABS0012L,Vampire
Entering Government Agency pan number,AAAGS0160A,Vampire
Entering Artificial Juridical Person pan number,AAAJJ0849E,Vampire
Entering Local Authority pan number,AAALS0235R,Vampire
Entering Trust pan number,AAATN2208D,Vampire
Entering Company pan number,AAHCD5090M,Vampire
Entering deactivated pan,ADOPJ2494G,Vampire
Entering deleted  pan,LJKPK2266E,Vampire
Entering death  pan,AQCPS5636E,Vampire
Entering no records pan,HAHPS7571R,Vampire
